{
  "blocking_gates": [],
  "commands_executed": [],
  "created_at": "2026-07-23T03:05:09Z",
  "data": {
    "generated_at": "2026-07-23T03:05:09Z",
    "lanes": [],
    "profile": "prehardware",
    "repairs": [],
    "status": "PASS",
    "version": "0.1.5",
    "warnings": []
  },
  "evidence_refs": [],
  "lane": "development-hygiene",
  "next_action": null,
  "profile": "prehardware",
  "reason_code": "SAFE_DRIFT_PREPARED",
  "required_action": null,
  "status": "PASS",
  "warnings": []
}
