{
  "blocking_gates": [],
  "commands_executed": [],
  "created_at": "2026-07-23T03:00:54Z",
  "data": {
    "capabilities": {
      "modules": {
        "jsonschema": true,
        "openpyxl": true,
        "pytest": true,
        "serial": false,
        "yaml": true
      },
      "platform": {
        "machine": "x86_64",
        "release": "6.12.13",
        "system": "Linux"
      },
      "python": {
        "available": true,
        "executable": "/opt/pyvenv/bin/python3",
        "version": "3.13.5"
      },
      "repo_root": "/mnt/data/bbws_v015_work/best_buds_cultivator_weight_station_v0_1_5",
      "serial_port_probe_error": null,
      "serial_ports": [],
      "tools": {
        "arduino_cli": {
          "available": false,
          "path": null,
          "version": null
        },
        "dpkg_deb": {
          "available": true,
          "exit_code": 0,
          "path": "/usr/bin/dpkg-deb",
          "version": "Debian 'dpkg-deb' package archive backend version 1.22.22 (amd64)."
        },
        "git": {
          "available": true,
          "exit_code": 0,
          "path": "/usr/bin/git",
          "version": "git version 2.47.3"
        }
      }
    },
    "drift": {
      "issues": [
        {
          "code": "CURRENT_MANIFEST_STALE",
          "path": "manifests/file_manifest.v0.1.5.json",
          "repairable": true,
          "severity": "warning"
        }
      ],
      "status": "drift",
      "version": "0.1.5"
    },
    "graph": {
      "graph_version": "1.1.0",
      "lanes": [
        {
          "lane": "repository-inspection",
          "requires": []
        },
        {
          "lane": "development-hygiene",
          "requires": [
            "repository-inspection"
          ]
        },
        {
          "lane": "software",
          "requires": [
            "development-hygiene"
          ]
        },
        {
          "lane": "agent-entrypoint",
          "requires": [
            "software"
          ]
        },
        {
          "lane": "software-dry-run",
          "requires": [
            "agent-entrypoint"
          ]
        },
        {
          "lane": "recovery-matrix",
          "requires": [
            "software-dry-run"
          ]
        },
        {
          "lane": "frontend-smoke",
          "requires": [
            "recovery-matrix"
          ]
        },
        {
          "lane": "packaging-preflight",
          "requires": [
            "frontend-smoke"
          ]
        },
        {
          "lane": "firmware",
          "requires": [
            "packaging-preflight"
          ]
        },
        {
          "lane": "serial",
          "requires": [
            "firmware"
          ]
        },
        {
          "lane": "zero-tare",
          "requires": [
            "serial"
          ]
        },
        {
          "lane": "calibration",
          "requires": [
            "zero-tare"
          ]
        },
        {
          "lane": "physical-loop",
          "requires": [
            "calibration"
          ]
        },
        {
          "lane": "release-packaging",
          "requires": [
            "physical-loop"
          ]
        }
      ],
      "package_version": "0.1.5"
    },
    "version": "0.1.5"
  },
  "evidence_refs": [
    "validation/receipts/repository-inspection.latest.json"
  ],
  "lane": "repository-inspection",
  "next_action": null,
  "profile": "prehardware",
  "reason_code": "REPOSITORY_INSPECTED",
  "required_action": null,
  "status": "PASS",
  "warnings": []
}
