{
  "blocking_gates": [],
  "commands_executed": [
    {
      "command": [
        "/opt/pyvenv/bin/python3",
        "-m",
        "pytest",
        "-q",
        "-p",
        "no:cacheprovider",
        "tests/test_operator_runtime_v016.py",
        "tests/test_device_service_v013.py"
      ],
      "duration_seconds": 3.703,
      "exit_code": 0,
      "stderr": "",
      "stdout": "..................                                                       [100%]\n"
    }
  ],
  "created_at": "2026-07-24T04:31:52Z",
  "data": {
    "physical_device_pass": false,
    "truth_class": "UNIT_TEST_PASS"
  },
  "evidence_refs": [],
  "lane": "scripted-device",
  "next_action": null,
  "profile": "operator-ready",
  "reason_code": "SCRIPTED_DEVICE_PASSED",
  "required_action": null,
  "status": "PASS",
  "warnings": []
}
